Timestamp,Numele Proiectului,Descrierea proiectului,Categoria proiectului,Beneficiarii solutiei,Seriile de date deschise utilizate in proiect,Functionalitatile proiectului,Specificatiile proiectului,Numele autorului,Email autor,Nume participant 1,Email participant 1,Rol participant 1,Nume participant 2,Email participant 2,Rol participant 2,Nume participant 3,Email participant 3,Rol participant 3,Nume participant 4,Email participant 4,Rol participant 4,Nume participant 5,Email participant 5,Rol participant 5,Nume participant 6,Email participant 6,Rol participant 6,Nume participant 7,Email participant 7,Rol participant 7,Nume participant 8,Email participant 8,Rol participant 8,Nume participant 9,Email participant 9,Rol participant 9,Nume participant 10,Email participant 10,Rol participant 10,Rol participant 10,Nume participant 11,Email participant 11,Rol participant 11,Nume participant 12,Email participant 12,Rol participant 12,Tehnologiile si/sau aplicatiile utilizate,Online demo link,Github repository,Stadiul proiectului,Awards
19/04/2015 15:30:39,openmart,Site de prezentare a pieselor de arta de la muzeul de arta din Timisoara,,muzeul de arta timisoara + vizitatorii sai,"lucrari din galeria de arta:https://docs.google.com/spreadsheets/d/13VgGX3-q9wck8WExmGdHz24td09wBuWIFCIP9RvLjrA/edit","site prezentare - finalizatgalerie - finalizatpagina prezentare pentru fiecare opera - finalizatcomments - finalizatinserarea de date se face in excel, de unde este preluata in web sub forma de date deschise  - finalizat",,adrian szakas,szakasad@gmail.com,Petru Isfan,petru.isfan@gmail.com,programator,Livia Mateias,mateiaslivia@gmail.com,designer,Marius Jurca,m.10.20.17.2.1@gmail.com,designer,Daniel Pop,danielpop@gmail.com,programator,,,,,,,,,,,,,,,,,,,,,,,,,,"Angular, bootstrap, google docs, html, css",,https://github.com/mysmartcity/openmart,ALPHA, Locul 2
19/04/2015 15:49:25,Timisoara CITY ART,"Cu City Art TM ai posibilitatea sa descoperi  monumentele si operele de arta din Timisoara, sa le cunosti istoria si semnificatia si sa le localizezi pe harta.City Art Tm este o aplicatie destinata tuturor iubitorilor de arta, dar si celor care viziteaza Timisoara, si isi doresc sa cunoasca o parte din istoria acestui oras.",,"Aplicatia se adreseaza turistilor care viziteaza orasul Timisoara, aceasta fiind proiectata sa functioneze in mai multe limbi. Ea se adreseaza totodata cetatenilor din Timisoara interesati de cultura si arta orasului.","Lista monumentelor din Timisoara, set de date furnizat de catre Fundatia Triade:https://docs.google.com/document/d/1LntGmnBFdu3jSd0vr9i1SJtoBJ2rwTQlLyscgS2s7Z4/edit?usp=sharing","- Lista cu monumentele din Timisoara;- Harta cu monumentele din Timisoara;- Posibilitatea ca turistul sa poata sa exploreze spatiul inconjurator folosind tehnologii de realitate augmentata si avand astfel oportunitatea sa descopere monumentele din apropierea sa intr-un mod inovativ si atragator;- Posibiltatea de a marca anumite monumente ca fiind favorite si de a le accesa ulterior;- Posibilitatea de a distribui informatii despre monumentele vizitate, pe retelele sociale;- Posibitatea de vizualiza informatii detaliate despre fiecare monument, cum ar fi: nume, creator, an, material, context, descriere, locatie, etc.",,Silviu Vert,silviu.vert@gmail.com,Voina Sorina,sorina.voina@gmail.com,Designer,Victor Holotescu,victor.holotescu@yahoo.ro,Android Developer,Aurel Chiper,chiper.aurel@gmail.com,Android Developer,Daniela Imbrescu,imbrescudaniela@gmail.com,Copy editing,Silviu Vert,silviu.vert@gmail.com,Coordonator,,,,,,,,,,,,,,,,,,,,,,,"Android, JAVA, SQL Lite, Metaio SDK for Android (Platforma de Realitate Augmentata), Adobe Photoshop, Adobe Illustrator",,,ALPHA, Locul 1
19/04/2015 16:02:35,Album Regal,Album cu portrete ale familiei regale cu informatii despre fotografie si persoanele din imagini.,,Publicul larg,http://cautare-b.arhivelenationale.ro/cautare-b/archivplansuche.aspx?ID=220980,"* Pagina cu thumbnail-uri ale portretelor* Pagini cu informatii despre fotografie si verso* Pagini cu informatii despre persoanele din fotografii",,Alex Morega,alex@grep.ro,Alex Morega,alex@grep.ro,Programator,Nicolaie Constantinescu,kosson@gmail.com,Architect,Valentina Pavel,valentina.pavel@gmail.com,Data god,,,,,,,,,,,,,,,,,,,,,,,,,,,,,HTML,,,ALPHA, Locul 3
19/04/2015 16:03:48,Cartea mea postala,Proiectul presupune dezvoltarea unei aplicatii software interactive care sa permita utilizatorului imbinarea unei carti postale vechi cu cladiri cu o alta poza a starii sale actuale.,,Publicul larg,,"Doua slideshow-uri pentru selectia unei carti postale, respectiv a unei poze noi.(in lucru, pentru integrarea simultana a doua imagini)Aplicare de efecte(blur/brightness/contrast/opacity/sepia/invert/etc)pe poza curenta selectata.Suprapunerea de imagini cu posibilitatea de a ""razuire"" a uneia dintre ele pentru a se vedea si cealalta. (In lucru, trebuie integrat cu selectia pozelor si aplicarea de efecte)Salvarea imaginii prelucrate (in intentie)",,Andra Bucur,andra.t.bucur@gmail.com,Timea Retek,timea.retek@gmail.com,developer,Silviu Iacob,iacob.silviu.89@gmail.com,developer,Andra Bucur,andra.t.bucur@gmail.com,coordonator,,,,,,,,,,,,,,,,,,,,,,,,,,,,,"JavascriptCSSHTML",,,STARTED, Mentiune
19/04/2015 16:06:41,AppsShowcase,Start business components for Apps Showcase,,"Public institutions, hackathons, IT community",,"- online - AWS server- REST implementation for LIST, DELETE, ADD, UPDATE- pagination- filter",,Dan Bugariu,dan.bugariu@gmail.com,Dan Bugariu,dan.bugariu@gmail.com,Architect & developer,,,,,,,,,,,,,,,,,,,,,,,,,,,,,,,,,,,"Java EE, JAX-RS, JPAWildFlyAWS",http://ec2-52-28-69-136.eu-central-1.compute.amazonaws.com/,,STARTED, 